Error Type,Minimal Pair,Tier,Label,Runtime Behaviour,Justification,Cantonese Source
Existential 'Have',Have many people here. → There are many people here.,2,[Prescriptive],Flag + Explain,Changes meaning structure. Genuine error even in casual contexts.,呢度有好多人 (lit. 'here have many people')
Resumptive Pronoun,The person who I met him. → The person who I met.,2,[Prescriptive],Flag + Explain,Genuine relative clause error. Needs explanation of English syntax.,我見過嗰個人佢... (topic chain with resumptive)
Question Tag (Fixed 'isn't it'),"You like it, isn't it? → You like it, don't you?",2,[Prescriptive],Flag + Explain,Wrong grammar pattern; confusing to readers. Needs tag question rule explanation.,"你鍾意,係唔係? (lit. 'is not is?')"
Calque Verb: 'Open/Close',Open the light. → Turn on the light.,2,[Prescriptive],Flag + Explain,Lexical error; confusing to non-HK readers. Needs verb collocation explanation.,開燈 (lit. 'open light')
Calque Verb: 'Eat Medicine',Eat medicine. → Take medicine.,2,[Prescriptive],Flag + Explain,Lexical error; sounds childish or non-native.,食藥 (lit. 'eat medicine')
'Got' for 'Have/There is',Got people inside. → There are people inside.,2,[Prescriptive],Flag + Explain,Non-standard existential. Needs explanation of 'there is/are' vs 'have/got'.,入面有人 (Colloquial Cantonese 有)
